 create database jobs;
Query OK, 1 row affected (0.01 sec)
use jobs;
Database changed
create table regions (region_id int not null auto_increment,region_name varchar(20), primary key(region_id));
Query OK, 0 rows affected (0.02 sec)

mysql> Query OK, 0 rows affected (0.24 sec)
    -> ^C
mysql> desc regions;
+-------------+-------------+------+-----+---------+----------------+
| Field       | Type        | Null | Key | Default | Extra          |
+-------------+-------------+------+-----+---------+----------------+
| region_id   | int         | NO   | PRI | NULL    | auto_increment |
| region_name | varchar(20) | YES  |     | NULL    |                |
+-------------+-------------+------+-----+---------+----------------+
2 rows in set (0.01 sec)

mysql> create table countries (countrie_id int not null auto_increment,countrie_name varchar(20),region_id int, primary key(countrie_id),foreign key(region_id) references regions(region_id));
Query OK, 0 rows affected (0.02 sec)

mysql> desc countries;
+---------------+-------------+------+-----+---------+----------------+
| Field         | Type        | Null | Key | Default | Extra          |
+---------------+-------------+------+-----+---------+----------------+
| countrie_id   | int         | NO   | PRI | NULL    | auto_increment |
| countrie_name | varchar(20) | YES  |     | NULL    |                |
| region_id     | int         | YES  | MUL | NULL    |                |
+---------------+-------------+------+-----+---------+----------------+
3 rows in set (0.01 sec)

mysql> create table locations (location_id int not null auto_increment,street_address varchar(50),postal_code varchar(20),city varchar(20),state_province varchar(30),countrie_id int,primary key(location_id),foreign key(countrie_id)references countries(countrie_id));
Query OK, 0 rows affected (0.04 sec)

mysql> desc locations
    -> ^C
mysql> desc locations;
+----------------+-------------+------+-----+---------+----------------+
| Field          | Type        | Null | Key | Default | Extra          |
+----------------+-------------+------+-----+---------+----------------+
| location_id    | int         | NO   | PRI | NULL    | auto_increment |
| street_address | varchar(50) | YES  |     | NULL    |                |
| postal_code    | varchar(20) | YES  |     | NULL    |                |
| city           | varchar(20) | YES  |     | NULL    |                |
| state_province | varchar(30) | YES  |     | NULL    |                |
| countrie_id    | int         | YES  | MUL | NULL    |                |
+----------------+-------------+------+-----+---------+----------------+
6 rows in set (0.00 sec)

mysql>  create table departments (department_id int not null auto_increment,department_name varchar(30),location_id int,primary key(department_id),foreign key(location_id) references locations(location_id));
Query OK, 0 rows affected (0.04 sec)

mysql> desc departments;
+-----------------+-------------+------+-----+---------+----------------+
| Field           | Type        | Null | Key | Default | Extra          |
+-----------------+-------------+------+-----+---------+----------------+
| department_id   | int         | NO   | PRI | NULL    | auto_increment |
| department_name | varchar(30) | YES  |     | NULL    |                |
| location_id     | int         | YES  | MUL | NULL    |                |
+-----------------+-------------+------+-----+---------+----------------+
3 rows in set (0.01 sec)

mysql> create table jobs (job_id int not null auto_increment,job_title varchar(20),min_salary int ,max_salary int,primary key(job_id));
Query OK, 0 rows affected (0.03 sec)

mysql> desc jobs;
+------------+-------------+------+-----+---------+----------------+
| Field      | Type        | Null | Key | Default | Extra          |
+------------+-------------+------+-----+---------+----------------+
| job_id     | int         | NO   | PRI | NULL    | auto_increment |
| job_title  | varchar(20) | YES  |     | NULL    |                |
| min_salary | int         | YES  |     | NULL    |                |
| max_salary | int         | YES  |     | NULL    |                |
+------------+-------------+------+-----+---------+----------------+
4 rows in set (0.00 sec)

mysql> create table manager (manager_id int not null auto_increment,name varchar(20),primary key(manager_id));
Query OK, 0 rows affected (0.06 sec)

mysql> desc manager;
+------------+-------------+------+-----+---------+----------------+
| Field      | Type        | Null | Key | Default | Extra          |
+------------+-------------+------+-----+---------+----------------+
| manager_id | int         | NO   | PRI | NULL    | auto_increment |
| name       | varchar(20) | YES  |     | NULL    |                |
+------------+-------------+------+-----+---------+----------------+
2 rows in set (0.01 sec)

mysql> CREATE TABLE `employee` ( `employee_id` INT NOT NULL AUTO_INCREMENT, `first_name` VARCHAR(20), `last_name` VARCHAR(20), `email` VARCHAR(30), `phone_number` INT(12), `hire_date` DATE, `job_id` INT, 
    -> `salary` INT, `manager_id` INT, `department_id` INT, PRIMARY KEY (`employee_id`), foreign key(job_id) references jobs(job_id), foreign key(manager_id) references manager(manager_id), foreign key(department_id) references departments(department_id));
Query OK, 0 rows affected, 1 warning (0.05 sec)

mysql> desc employee;
+---------------+-------------+------+-----+---------+----------------+
| Field         | Type        | Null | Key | Default | Extra          |
+---------------+-------------+------+-----+---------+----------------+
| employee_id   | int         | NO   | PRI | NULL    | auto_increment |
| first_name    | varchar(20) | YES  |     | NULL    |                |
| last_name     | varchar(20) | YES  |     | NULL    |                |
| email         | varchar(30) | YES  |     | NULL    |                |
| phone_number  | int         | YES  |     | NULL    |                |
| hire_date     | date        | YES  |     | NULL    |                |
| job_id        | int         | YES  | MUL | NULL    |                |
| salary        | int         | YES  |     | NULL    |                |
| manager_id    | int         | YES  | MUL | NULL    |                |
| department_id | int         | YES  | MUL | NULL    |                |
+---------------+-------------+------+-----+---------+----------------+
10 rows in set (0.01 sec)

mysql>  create table dependents (dependent_id int not null auto_increment,first_name varchar(30), last_name varchar(30), relationship varchar(30), employee_id int ,primary key(dependent_id),foreign key(employee_id) references employee(employee_id));
Query OK, 0 rows affected (0.05 sec)

mysql> desc dependents;
+--------------+-------------+------+-----+---------+----------------+
| Field        | Type        | Null | Key | Default | Extra          |
+--------------+-------------+------+-----+---------+----------------+
| dependent_id | int         | NO   | PRI | NULL    | auto_increment |
| first_name   | varchar(30) | YES  |     | NULL    |                |
| last_name    | varchar(30) | YES  |     | NULL    |                |
| relationship | varchar(30) | YES  |     | NULL    |                |
| employee_id  | int         | YES  | MUL | NULL    |                |
+--------------+-------------+------+-----+---------+----------------+
5 rows in set (0.00 sec)

mysql> show tables;
+----------------+
| Tables_in_jobs |
+----------------+
| countries      |
| departments    |
| dependents     |
| employee       |
| jobs           |
| locations      |
| manager        |
| regions        |
+----------------+
8 rows in set (0.00 sec)

mysql> insert into regions values(1001,'Europe'),(1002,'America'),(1003,'Eurasia'),(1004,'Africa'),(1005,'Asia'),(1006,'Antarctica'),(1007,'Australia');
Query OK, 7 rows affected (0.03 sec)
Records: 7  Duplicates: 0  Warnings: 0

mysql> select*from regions;
+-----------+-------------+
| region_id | region_name |
+-----------+-------------+
|      1001 | Europe      |
|      1002 | America     |
|      1003 | Eurasia     |
|      1004 | Africa      |
|      1005 | Asia        |
|      1006 | Antarctica  |
|      1007 | Australia   |
+-----------+-------------+
7 rows in set (0.00 sec)

mysql> delete from regions where region_id=10;
Query OK, 0 rows affected (0.00 sec)

mysql> select*from regions;
+-----------+-------------+
| region_id | region_name |
+-----------+-------------+
|      1001 | Europe      |
|      1002 | America     |
|      1003 | Eurasia     |
|      1004 | Africa      |
|      1005 | Asia        |
|      1006 | Antarctica  |
|      1007 | Australia   |
+-----------+-------------+
7 rows in set (0.00 sec)

mysql> insert into countries values(2001,'jermany',1001),(2002,'Mexico',1002),(2003,'Russia',1003),(2004,'Nigeria',1004),(2005,'India',1005),(2006,'France',1006),(2007,'New zealand',1007);
Query OK, 7 rows affected (0.03 sec)
Records: 7  Duplicates: 0  Warnings: 0

mysql> select*from countries;
+-------------+---------------+-----------+
| countrie_id | countrie_name | region_id |
+-------------+---------------+-----------+
|        2001 | jermany       |      1001 |
|        2002 | Mexico        |      1002 |
|        2003 | Russia        |      1003 |
|        2004 | Nigeria       |      1004 |
|        2005 | India         |      1005 |
|        2006 | France        |      1006 |
|        2007 | New zealand   |      1007 |
+-------------+---------------+-----------+
7 rows in set (0.00 sec)

mysql> insert into locations values(1100,'zeli',84210,'Berlin','Hamburg',2001),(1200,'Madero street',70008,'Tijuana','Chiapas', 2002),(1300,'Sovetskaya',68215,'Moscow','st peterburg',2003),(1400,'Toyin street',45681,'Lagos','Imo state',2004),(1500,'Chandni chowk',22389,'Delhi','Delhi',2005),(1600,'Champs Elysees',18998,'Paris','Corsica',2006),(1700,'Queen street',21456,'Hamilton','Auckland',2007);
Query OK, 7 rows affected (0.02 sec)
Records: 7  Duplicates: 0  Warnings: 0

mysql>  select*from locations;
+-------------+----------------+-------------+----------+----------------+-------------+
| location_id | street_address | postal_code | city     | state_province | countrie_id |
+-------------+----------------+-------------+----------+----------------+-------------+
|        1100 | zeli           | 84210       | Berlin   | Hamburg        |        2001 |
|        1200 | Madero street  | 70008       | Tijuana  | Chiapas        |        2002 |
|        1300 | Sovetskaya     | 68215       | Moscow   | st peterburg   |        2003 |
|        1400 | Toyin street   | 45681       | Lagos    | Imo state      |        2004 |
|        1500 | Chandni chowk  | 22389       | Delhi    | Delhi          |        2005 |
|        1600 | Champs Elysees | 18998       | Paris    | Corsica        |        2006 |
|        1700 | Queen street   | 21456       | Hamilton | Auckland       |        2007 |
+-------------+----------------+-------------+----------+----------------+-------------+
7 rows in set (0.00 sec)

mysql> insert into  departments values(1,'Finance',1100),(2,'Management',1200),(3,'Quality assurance',1300),(4,'Accounting',1400),(5,'Marketing',1500),(6,'Engineering',1600),(7,'Law',1700);
Query OK, 7 rows affected (0.03 sec)
Records: 7  Duplicates: 0  Warnings: 0

mysql> select*from  departments;
+---------------+-------------------+-------------+
| department_id | department_name   | location_id |
+---------------+-------------------+-------------+
|             1 | Finance           |        1100 |
|             2 | Management        |        1200 |
|             3 | Quality assurance |        1300 |
|             4 | Accounting        |        1400 |
|             5 | Marketing         |        1500 |
|             6 | Engineering       |        1600 |
|             7 | Law               |        1700 |
+---------------+-------------------+-------------+
7 rows in set (0.00 sec)

mysql> insert into jobs values(10,'Loan officer',15000,20000),(20,'Data entry',5000,8000),(30,'Quality Engineer',30000,65000),(40,'Senior Accountant',28000,45000),(50,'Marketing manager',35000,69000),(60,'Civil Engineer',30000,70000),(70,'Advocate',90000,10);
Query OK, 7 rows affected (0.02 sec)
Records: 7  Duplicates: 0  Warnings: 0

mysql> select*from jobs;
+--------+-------------------+------------+------------+
| job_id | job_title         | min_salary | max_salary |
+--------+-------------------+------------+------------+
|     10 | Loan officer      |      15000 |      20000 |
|     20 | Data entry        |       5000 |       8000 |
|     30 | Quality Engineer  |      30000 |      65000 |
|     40 | Senior Accountant |      28000 |      45000 |
|     50 | Marketing manager |      35000 |      69000 |
|     60 | Civil Engineer    |      30000 |      70000 |
|     70 | Advocate          |      90000 |         10 |
+--------+-------------------+------------+------------+
7 rows in set (0.00 sec)


mysql> insert into manager values(31,"Madav"),(32,"Arpitha"),(33,"Neehu"),(34,"Geethu"),(37,"Sreeram"),(36,"Varun"),(43,"Sharan");
Query OK, 7 rows affected (0.01 sec)
Records: 7  Duplicates: 0  Warnings: 0

mysql> select*from manager;
+------------+---------+
| manager_id | name    |
+------------+---------+
|         31 | Madav   |
|         32 | Arpitha |
|         33 | Neehu   |
|         34 | Geethu  |
|         36 | Varun   |
|         37 | Sreeram |
|         43 | Sharan  |
+------------+---------+
7 rows in set (0.01 sec)
mysql> insert into employee values(61234,"Dhruv","mohan","dhruvmohan02@gmail.com",979413510,"1997-07-26",10,25000,34,5);
Query OK, 1 row affected (0.03 sec)

mysql> insert into employee values(86324,"Ethan","Jack","ethanjack09@gmail.com",900599198,"2002-05-11",20,7000,33,2);
Query OK, 1 row affected (0.00 sec)

mysql> insert into employee values(10158,"Zack","John","zackjohn28@gmail.com",885318964,"05-03-2004",40,32000,37,4);
ERROR 1292 (22007): Incorrect date value: '05-03-2004' for column 'hire_date' at row 1
mysql> insert into employee values(10158,"Zack","John","zackjohn28@gmail.com",885318964,"2004-03-05",40,32000,37,4);
Query OK, 1 row affected (0.01 sec)

mysql> insert into employee values(29052,"Isaac","mathew","issacmathew45@gmail.com",775595585,"1994-05-08",60,40000,43,6);
Query OK, 1 row affected (0.02 sec)

mysql> insert into employee values(69532,"Milo","Luis","miloluis500@gmail.com",876543234,"12-09-2000",70,91000,31,7);
ERROR 1292 (22007): Incorrect date value: '12-09-2000' for column 'hire_date' at row 1
mysql> insert into employee values(69532,"Milo","Luis","miloluis500@gmail.com",876543234,"2000-09-12",70,91000,31,7);
Query OK, 1 row affected (0.04 sec)

mysql> select*from employee;
+-------------+------------+-----------+-------------------------+--------------+------------+--------+--------+------------+---------------+
| employee_id | first_name | last_name | email                   | phone_number | hire_date  | job_id | salary | manager_id | department_id |
+-------------+------------+-----------+-------------------------+--------------+------------+--------+--------+------------+---------------+
|       10158 | Zack       | John      | zackjohn28@gmail.com    |    885318964 | 2004-03-05 |     40 |  32000 |         37 |             4 |
|       29052 | Isaac      | mathew    | issacmathew45@gmail.com |    775595585 | 1994-05-08 |     60 |  40000 |         43 |             6 |
|       61234 | Dhruv      | mohan     | dhruvmohan02@gmail.com  |    979413510 | 1997-07-26 |     10 |  25000 |         34 |             5 |
|       69532 | Milo       | Luis      | miloluis500@gmail.com   |    876543234 | 2000-09-12 |     70 |  91000 |         31 |             7 |
|       86324 | Ethan      | Jack      | ethanjack09@gmail.com   |    900599198 | 2002-05-11 |     20 |   7000 |         33 |             2 |
+-------------+------------+-----------+-------------------------+--------------+------------+--------+--------+------------+---------------+
5 rows in set (0.00 sec)

mysql> insert into dependents values(512,"David","Grey","Brother-in-law",61234);
Query OK, 1 row affected (0.03 sec)

mysql> insert into dependents values(617,"Kevin","paul","cousin",86324);
Query OK, 1 row affected (0.04 sec)

mysql> insert into dependents values(533,"Jason","Ryan","Null",Null);
Query OK, 1 row affected (0.04 sec)

mysql> insert into dependents values(618,"Olivia","Liam","uncle",10158);
Query OK, 1 row affected (0.01 sec)

mysql> insert into dependents values(804,"Sophia","Sebastian","Aunty",29052);
Query OK, 1 row affected (0.04 sec)

mysql> insert into dependents values(408,"Michal","Thomas","son",69532);
Query OK, 1 row affected (0.04 sec)

mysql> insert into dependents values(331,"Adam","jerry","Null",Null);
Query OK, 1 row affected (0.02 sec)

mysql> select*from dependents;
+--------------+------------+-----------+----------------+-------------+
| dependent_id | first_name | last_name | relationship   | employee_id |
+--------------+------------+-----------+----------------+-------------+
|          331 | Adam       | jerry     | Null           |        NULL |
|          408 | Michal     | Thomas    | son            |       69532 |
|          512 | David      | Grey      | Brother-in-law |       61234 |
|          533 | Jason      | Ryan      | Null           |        NULL |
|          617 | Kevin      | paul      | cousin         |       86324 |
|          618 | Olivia     | Liam      | uncle          |       10158 |
|          804 | Sophia     | Sebastian | Aunty          |       29052 |
+--------------+------------+-----------+----------------+-------------+
7 rows in set (0.00 sec)


mysql> select e.first_name,e.last_name from employee e join departments l on e.department_id=l.department_id where l.location_id=1700;
+------------+-----------+
| first_name | last_name |
+------------+-----------+
| Milo       | Luis      |
+------------+-----------+
1 row in set (0.00 sec)

mysql> select e.first_name,e.last_name from employee e join departments l on e.department_id=l.department_id where l.location_id not in (1700);
+------------+-----------+
| first_name | last_name |
+------------+-----------+
| Zack       | John      |
| Isaac      | mathew    |
| Dhruv      | mohan     |
| Ethan      | Jack      |
+------------+-----------+
4 rows in set (0.01 sec)

mysql> select first-name,last_name,salary from employee where salary=(select max(salary)from employee);
ERROR 1054 (42S22): Unknown column 'first' in 'field list'
mysql> select first_name,last_name,salary from employee where salary=(select max(salary)from employee);
+------------+-----------+--------+
| first_name | last_name | salary |
+------------+-----------+--------+
| Milo       | Luis      |  91000 |
+------------+-----------+--------+
1 row in set (0.00 sec)

mysql> select first_name,last_name,salary from employee where salary>all(select avg(salary)from employee);
+------------+-----------+--------+
| first_name | last_name | salary |
+------------+-----------+--------+
| Isaac      | mathew    |  40000 |
| Milo       | Luis      |  91000 |
+------------+-----------+--------+
2 rows in set (0.00 sec)

mysql> select departments.department_id,department_name,employee.first_name,employee.last_name from departments, employee where departments.department_id=employee.department_id and employee.salary>10000;

+---------------+-----------------+------------+-----------+
| department_id | department_name | first_name | last_name |
+---------------+-----------------+------------+-----------+
|             4 | Accounting      | Zack       | John      |
|             6 | Engineering     | Isaac      | mathew    |
|             5 | Marketing       | Dhruv      | mohan     |
|             7 | Law             | Milo       | Luis      |
+---------------+-----------------+------------+-----------+
4 rows in set (0.00 sec)

mysql> select departments.department_id,department_name,employee.first_name,employee.last_name from departments, employee where departments.department_id=employee.department_id and employee.salary<10000;

+---------------+-----------------+------------+-----------+
| department_id | department_name | first_name | last_name |
+---------------+-----------------+------------+-----------+
|             2 | Management      | Ethan      | Jack      |
+---------------+-----------------+------------+-----------+
1 row in set (0.00 sec)

mysql> select first_name,last_name,salary,department_id from employee where salary>(select min(salary)from employee where department_id=department
    -> ^C
mysql> select first_name,last_name,salary,department_id from employee where salary>(select min(salary)from employee where department_id=department_id);
+------------+-----------+--------+---------------+
| first_name | last_name | salary | department_id |
+------------+-----------+--------+---------------+
| Zack       | John      |  32000 |             4 |
| Isaac      | mathew    |  40000 |             6 |
| Dhruv      | mohan     |  25000 |             5 |
| Milo       | Luis      |  91000 |             7 |
+------------+-----------+--------+---------------+
4 rows in set (0.01 sec)

mysql> select first_name,last_name,salary,department_id from employee where salary>=(select min(salary)from employee where department_id=department_id);
+------------+-----------+--------+---------------+
| first_name | last_name | salary | department_id |
+------------+-----------+--------+---------------+
| Zack       | John      |  32000 |             4 |
| Isaac      | mathew    |  40000 |             6 |
| Dhruv      | mohan     |  25000 |             5 |
| Milo       | Luis      |  91000 |             7 |
| Ethan      | Jack      |   7000 |             2 |
+------------+-----------+--------+---------------+
5 rows in set (0.00 sec)

mysql> select avg(avg_salary)as average_department_salary from(select department_id,avg(salary)as avg_salary from employee group by department_id)as department_salaries;
+---------------------------+
| average_department_salary |
+---------------------------+
|            39000.00000000 |
+---------------------------+
1 row in set (0.01 sec)


